{
  "$schema": "https://yen-gov.github.io/schemas/party.schema.json",
  "$schema_version": "3.1",
  "sources": [
    {
      "url": "https://results.eci.gov.in/ResultAcGenMay2026/partywiseresult-S03.htm",
      "fetched_at": "2026-05-12T22:33:39Z"
    },
    {
      "url": "https://results.eci.gov.in/ResultAcGenMay2026/partywiseresult-S11.htm",
      "fetched_at": "2026-05-12T22:33:39Z"
    },
    {
      "url": "https://results.eci.gov.in/ResultAcGenMay2026/partywiseresult-S22.htm",
      "fetched_at": "2026-05-12T22:33:39Z"
    },
    {
      "url": "https://results.eci.gov.in/ResultAcGenMay2026/partywiseresult-S25.htm",
      "fetched_at": "2026-05-12T22:33:39Z"
    },
    {
      "url": "https://results.eci.gov.in/ResultAcGenMay2026/partywiseresult-U07.htm",
      "fetched_at": "2026-05-12T22:33:39Z"
    },
    {
      "url": "https://www.eci.gov.in/eci-backend/public//all_files/election_report/General_Election_to_the_Legislative_Assembly_of_Bihar_October_to_November_2025_Statistical_Report_2025/3-List_Of_Political_Parties_Participated_1763549416.xlsx",
      "fetched_at": "2026-05-12T22:33:39Z"
    },
    {
      "url": "https://www.eci.gov.in/eci-backend/public//all_files/election_report/Jharkhand_Legislative_Assembly_Election__2024_2024/3-List_Of_Political_Parties_Participated_1744890626.xlsx",
      "fetched_at": "2026-05-12T22:33:39Z"
    },
    {
      "url": "https://www.eci.gov.in/eci-backend/public//all_files/election_report/Maharashtra_Legislative_Assembly_Election__2024_2024/3-List_Of_Political_Parties_Participated_1744889410.xlsx",
      "fetched_at": "2026-05-12T22:33:39Z"
    },
    {
      "url": "https://www.eci.gov.in/eci-backend/public//all_files/election_report/NCT_of_Delhi_Legislative_Assembly_Election_2025_2025/3-List_Of_Political_Parties_Participated_1744913224.xlsx",
      "fetched_at": "2026-05-12T22:33:39Z"
    },
    {
      "url": "https://www.eci.gov.in/eci-backend/public/all_files/AE-2024-statistical-report-AP/3-List-Of-Political-Parties-Participated.xlsx",
      "fetched_at": "2026-05-12T22:33:39Z"
    },
    {
      "url": "https://www.eci.gov.in/eci-backend/public/all_files/AE-2024-statistical-report-AR/3-List-Of-Political-Parties-Participated.xlsx",
      "fetched_at": "2026-05-12T22:33:39Z"
    },
    {
      "url": "https://www.eci.gov.in/eci-backend/public/all_files/AE-2024-statistical-report-HR/3-List-Of-Political-Parties-Participated.xlsx",
      "fetched_at": "2026-05-12T22:33:39Z"
    },
    {
      "url": "https://www.eci.gov.in/eci-backend/public/all_files/AE-2024-statistical-report-JK/3-List-Of-Political-Parties-Participated.xlsx",
      "fetched_at": "2026-05-12T22:33:39Z"
    },
    {
      "url": "https://www.eci.gov.in/eci-backend/public/all_files/AE-2024-statistical-report-OR/3-List-Of-Political-Parties-Participated.xlsx",
      "fetched_at": "2026-05-12T22:33:39Z"
    },
    {
      "url": "https://www.eci.gov.in/eci-backend/public/all_files/AE-2024-statistical-report-SK/3-List-Of-Political-Parties-Participated.xlsx",
      "fetched_at": "2026-05-12T22:33:39Z"
    },
    {
      "url": "https://www.eci.gov.in/eci-backend/public/all_files/full-statistical-reports/chhattisgarh/2023/List_Of_Political_Parties_Participated.xlsx",
      "fetched_at": "2026-05-12T22:33:39Z"
    },
    {
      "url": "https://www.eci.gov.in/eci-backend/public/all_files/full-statistical-reports/mizoram/2023/List_Of_Political_Parties_Participated.xlsx",
      "fetched_at": "2026-05-12T22:33:39Z"
    },
    {
      "url": "https://www.eci.gov.in/eci-backend/public/all_files/full-statistical-reports/mp/2023/List_Of_Political_Parties_Participated.xlsx",
      "fetched_at": "2026-05-12T22:33:39Z"
    },
    {
      "url": "https://www.eci.gov.in/eci-backend/public/all_files/full-statistical-reports/telangana/2023/List_Of_Political_Parties_Participated.xlsx",
      "fetched_at": "2026-05-12T22:33:39Z"
    }
  ],
  "election": "AcGenOct2019",
  "parties": [
    {
      "eci_code": "369",
      "short_name": "BJP",
      "full_name": "Bharatiya Janata Party"
    },
    {
      "eci_code": "742",
      "short_name": "INC",
      "full_name": "Indian National Congress"
    }
  ]
}
